{
  "id": "11111111-1111-1111-1111-111111111111",
  "title": "Review deployment logs",
  "description": "Check logs for any anomaly in the staging run",
  "priority": 4,
  "plan": null,
  "labels": ["22222222-2222-2222-2222-222222222222"],
  "parentId": null,
  "completedAt": null,
  "createdAt": "2026-08-18T12:00:00Z",
  "updatedAt": "2026-08-18T12:00:00Z",
  "version": 1
}
