{
  "id": "66666666-6666-6666-6666-666666666666",
  "title": "Configure Gradle wrapper",
  "description": null,
  "priority": 4,
  "plan": null,
  "labels": [],
  "parentId": "11111111-1111-1111-1111-111111111111",
  "completedAt": "2026-08-18T12:30:00Z",
  "createdAt": "2026-08-18T12:00:00Z",
  "updatedAt": "2026-08-18T12:30:00Z",
  "version": 2
}
