{
  "id": "11111111-1111-1111-1111-111111111111",
  "title": "Legacy v1 task without new fields",
  "description": null,
  "priority": 4,
  "plan": null,
  "labels": [],
  "parentId": null,
  "completedAt": null,
  "createdAt": "2026-08-01T10:00:00Z",
  "updatedAt": "2026-08-01T10:00:00Z",
  "version": 1
}
